{
  "$schema": "https://json-schema.org/draft/2020-12/schema",
  "title": "explainer diagrams/swimlanes data",
  "description": "Lanes x columns grid, one optional box per cell, optional arrows between cells. Validated by lib/includes.mjs's handleDiagram against the same built-ins-only subset lib/schema.mjs interprets (type, minLength, minItems, properties, required, additionalProperties, items) — see core/diagrams/swimlanes/README.md. Cross-references (a cells key naming an unknown column, an arrow naming an unknown lane:column) aren't schema-expressible and are checked by render.mjs itself.",
  "type": "object",
  "required": ["columns", "lanes"],
  "additionalProperties": false,
  "properties": {
    "title": { "type": "string", "description": "Diagram <title>, for accessibility; falls back to \"Swimlanes\"." },
    "columns": {
      "type": "array",
      "minItems": 1,
      "description": "Grid columns, left to right in array order.",
      "items": {
        "type": "object",
        "required": ["id", "label"],
        "additionalProperties": false,
        "properties": {
          "id": { "type": "string", "minLength": 1, "description": "Referenced by lanes[].cells keys and arrows[].from/to." },
          "label": { "type": "string", "minLength": 1, "description": "Column header; wraps to the column's width budget." }
        }
      }
    },
    "lanes": {
      "type": "array",
      "minItems": 1,
      "description": "Grid rows, top to bottom in array order.",
      "items": {
        "type": "object",
        "required": ["id", "label"],
        "additionalProperties": false,
        "properties": {
          "id": { "type": "string", "minLength": 1, "description": "Referenced by arrows[].from/to as \"laneId:columnId\"." },
          "label": { "type": "string", "minLength": 1, "description": "Row header; wraps to the row-header width budget." },
          "cells": {
            "type": "object",
            "description": "Keyed by a columns[].id; a column with no key here is drawn as an empty cell.",
            "additionalProperties": {
              "type": "object",
              "required": ["label"],
              "additionalProperties": false,
              "properties": {
                "label": { "type": "string", "minLength": 1 },
                "new": { "type": "boolean", "description": "Draws the cell's box with the shared \"new\" class instead of \"same\". Takes precedence over \"changed\" if both are set." },
                "changed": { "type": "boolean", "description": "Draws the cell's box with the shared \"changed\" class instead of \"same\"." },
                "panel": {
                  "type": "string",
                  "minLength": 1,
                  "description": "A contents.json page panels[].key; makes the cell a clickable node."
                }
              }
            }
          }
        }
      }
    },
    "arrows": {
      "type": "array",
      "description": "Connectors drawn after every cell, each between two cells that must both exist.",
      "items": {
        "type": "object",
        "required": ["from", "to"],
        "additionalProperties": false,
        "properties": {
          "from": { "type": "string", "minLength": 1, "description": "\"laneId:columnId\" of a lane with a cell at that column." },
          "to": { "type": "string", "minLength": 1, "description": "\"laneId:columnId\" of a lane with a cell at that column." },
          "dashed": { "type": "boolean", "description": "Draws the connector dashed." }
        }
      }
    }
  }
}
